{
  "schemaId": "cd-collab.investigation_reference.v1",
  "id": "5c4b3a29-1807-4f6e-bd5c-4a3b2c1d0e9f",
  "fromInvestigationId": "22222222-2222-4222-8222-222222222222",
  "toInvestigationId": "11111111-1111-4111-8111-111111111111",
  "resourceKind": "investigation",
  "resourceId": "11111111-1111-4111-8111-111111111111",
  "locator": "/investigations/11111111-1111-4111-8111-111111111111/situation?section=stage-situation#stage-situation",
  "note": "Same synthetic timeout signature as the 2019 investigation.",
  "recordedTitle": "Synthetic checkout timeouts (2019)",
  "currentTitle": "Synthetic checkout timeouts (2019)",
  "visibility": "resolved",
  "state": "active",
  "occurredAt": null,
  "occurredAtPrecision": "unknown",
  "recordedAt": "2024-02-11T09:25:00.000Z",
  "recordedBy": "synthetic-operator",
  "recordedByUsername": "synthetic-operator",
  "withdrawnAt": null,
  "occurredAtZone": "unspecified"
}
